{
  "schemaVersion": "1.0.0",
  "contractId": "cursor-zero-command-governed-execution-v1",
  "planDirectory": ".execution-governance/plans/cursor-zero-command-governed-execution-v1",
  "currentPhase": "CZC-PHASE-1",
  "status": {
    "plan_state": "LOCKED_FOR_IMPLEMENTATION",
    "implementation_state": "EXECUTOR_VERIFIED",
    "executor_checks": "PASS",
    "independent_review": "NOT_REQUESTED",
    "user_acceptance": "PENDING"
  },
  "events": [
    {
      "eventId": "CZC-EVENT-001",
      "timestamp": "2026-08-25T00:00:00Z",
      "actor": "Codex",
      "eventType": "PLAN_DRAFTED",
      "summary": "Drafted the zero-command Cursor governed execution plan package for user approval and plan-lock commit."
    },
    {
      "eventId": "CZC-EVENT-002",
      "timestamp": "2026-08-25T16:56:59Z",
      "actor": "Codex",
      "eventType": "IMPLEMENTATION_REPORTED",
      "summary": "Implemented zero-command Cursor governed execution tooling and recorded executor verification.",
      "recordPath": ".execution-governance/plans/cursor-zero-command-governed-execution-v1/implementation-report.json"
    },
    {
      "eventId": "CZC-EVENT-003",
      "timestamp": "2026-08-25T16:56:59Z",
      "actor": "governance-cli",
      "eventType": "EXECUTOR_CHECK_RECORDED",
      "summary": "Acceptance run-checks passed for CZC-PHASE-1.",
      "recordPath": ".execution-governance/runtime/run-records/run-2026-08-25T16-56-59-013Z-2184.json"
    }
  ],
  "independentReviewPolicy": {
    "defaultState": "NOT_REQUESTED",
    "requiresExplicitUserRequest": true,
    "createReviewRecordWhenNotRequested": false,
    "reviewerMayModifyImplementation": false
  }
}
